{
  "schema_version": "1.0",
  "validation_id": "RRULER-RRULE-SELF-RELAY-001",
  "canonical_automation_id": "6aaf8a993eb08191b8d0ab1d9662e4b2",
  "status": "IN_PROGRESS",
  "acceptance": {
    "canonical_id_preserved": {"status": "PASS", "blocking": true, "evidence": ["phase :30 -> :45", "phase :45 -> :00", "phase :00 -> :15"]},
    "recurring_rrule_preserved": {"status": "PASS", "blocking": true, "expected_base": "FREQ=HOURLY;BYSECOND=0", "effective_phase_sequence": [0, 15, 30, 45]},
    "two_or_more_phase_transitions": {"status": "PASS", "blocking": true, "observed_transitions": [":30->:45", ":45->:00", ":00->:15"]},
    "scheduled_cold_continuation_from_github": {"status": "PASS", "blocking": true, "evidence": "Scheduled successor reconstructed CP-BOOTSTRAP-004/005 from durable GitHub state and continued substantive work."},
    "additional_cycle_without_continuation_loss": {"status": "PASS", "blocking": true, "evidence": "Later scheduled execution rotated :00->:15 and reconstructed durable authority."},
    "github_state_coherent": {"status": "PASS", "blocking": true, "evidence": "Control-plane validator succeeded after machine validation integration: run 35506851376 on commit 7bb0334f410a195cd4c952510c3f2cb404380203."},
    "runtime_timeout_does_not_break_cycle": {"status": "PASS_WITH_SCOPE", "blocking": true, "scope": "Observed continuation across multiple scheduled executions; no claim about unbounded platform runtime behavior."},
    "overlap_or_serialization_semantics_classified": {"status": "PENDING", "blocking": false, "required_evidence": "Durable timestamps/run ownership or direct platform evidence sufficient to distinguish safe overlap from serialization without inference from chat prose.", "rationale": "Reproduction correctness is explicitly designed to work under either overlap or serialization; classification improves performance characterization but is not required to reproduce the durable relay."},
    "utilization_handoff_measurement": {"status": "PENDING", "blocking": false, "required_evidence": "At least one observable predecessor productive-end and successor productive-start pair using a common durable clock basis.", "rationale": "Precise utilization measurement is an optimization/characterization objective. Missing precision must remain null and must not block a correctness PASS when no-voluntary-idle policy and multi-cycle continuation are evidenced."}
  },
  "pass_rule": "Overall PASS is permitted when every acceptance item with blocking=true is PASS or PASS_WITH_SCOPE, no blocking item is FAIL/PENDING, public-safe durable state remains coherent, and pending non-blocking observations are explicitly documented rather than inferred.",
  "next_action": "At the next successor-triggered boundary, record any directly observable handoff timing/concurrency evidence. If no blocking criterion regresses, promote overall relay validation to PASS, update CURRENT terminal bootstrap evidence, and disable the bootstrap relay."
}
